Id|Title|Description|TypeId|Rarity|Difficulty|PackSize|WeaponId|EffectId
ExplodingAlien|Alien shaped like a bomb|The alien looks unstable|Alien|3|2|1|Bomb|Exploding
StarCreature|Miniature Star|A ball of flaming light, barely a hand's width across.<br/>Its light burns your eyes, and you feel its malice somehow portrayed through its featureless landscape of roiling plasma.<br/>It hates you. It <i class="emphBold">hates</i> what you are. But it adores your presence here, for your deliciously singeable skin is within reach of its mass of millions-of-degrees hot tendrils of hydrogen.|Cosmic|2|0|1|CME|none
Drone|Drones|A swarm of robotic drones, perhaps originally intended for repair jobs; now outfitted with firearms and each covered in scrapes and burns.|Robot|10|2|3|Laser|none
Arm|Robotic Arm|An advanced prosthetic limb, severed and taken over by a lump of pulsing flesh. You think it shouldn't be able to see, but it lunges at you; <i class="emphItalic">and it is surprisingly agile.</i>|Robot|4|0|0|Arm|none
Soldiers|Soldiers|Previous explorers, or a creation of the <i class="emphRed">Star Tomb</i> itself.<br/>They bark something as you round the corner; no language you know of. There is a glow in their eyes.<br/>They are not themselves.<br/>They raise their weapons.|Humanoid|6|3|4|Laser|none